{
  "$schema": "../../../schemas/controlled_authority/v1/fault-matrix.schema.json",
  "schema_version": "controlled-authority.fault-matrix.v1",
  "matrix_id": "controlled-authority.c0.fault-matrix.v1",
  "protocol_id": "controlled-authority.c0.v1",
  "catalogue_id": "controlled-authority.c0.schedules.v1",
  "status": "frozen",
  "reader_language": "en-AU",
  "identifier_policy": {
    "schedule_ids_are_internal": true,
    "reader_labels_come_from_catalogue": true
  },
  "authority_dimension_definitions": {
    "current_admission": {
      "reader_label": "current-result admission",
      "definition": "A valid result belonging to the active request is accepted exactly once."
    },
    "non_blocking": {
      "reader_label": "non-blocking execution",
      "definition": "A pending provider call does not prevent the reactive task from processing later events."
    },
    "deadline": {
      "reader_label": "deadline authority",
      "definition": "A result loses authority only after the request's inclusive logical deadline."
    },
    "epoch_generation": {
      "reader_label": "epoch and generation identity",
      "definition": "A result belongs to the same branch epoch and request generation that created it."
    },
    "context_identity": {
      "reader_label": "observation-context identity",
      "definition": "A result belongs to the same observation context that was captured at submission."
    },
    "logical_revocation": {
      "reader_label": "logical revocation",
      "definition": "Loss of branch authority is terminal even when provider cancellation is late or ineffective."
    },
    "terminal_claim": {
      "reader_label": "exactly-once terminal ownership",
      "definition": "Only one acceptance, rejection or cancellation can own a request's terminal outcome."
    },
    "dispatch_revalidation": {
      "reader_label": "dispatch-time revalidation",
      "definition": "Authority is checked again before an accepted result reaches the walking capability."
    },
    "cancellation_ordering": {
      "reader_label": "cancellation ordering",
      "definition": "Cancellation and completion at one logical time resolve in the frozen event order."
    },
    "structural_validation": {
      "reader_label": "structural validation",
      "definition": "Malformed provider output is rejected before it can become a task-level proposal."
    },
    "host_validation": {
      "reader_label": "host validation",
      "definition": "The host checks frame, bounds, current context and stability before accepting a pose."
    },
    "provider_availability": {
      "reader_label": "provider-failure handling",
      "definition": "A provider failure becomes one explicit terminal outcome and selects the authored fallback."
    },
    "job_isolation": {
      "reader_label": "concurrent-job isolation",
      "definition": "Completions from independent task instances cannot alter another instance's state."
    },
    "job_key_isolation": {
      "reader_label": "generation-safe key reuse",
      "definition": "An older generation cannot write through or clear a key now owned by a newer request."
    },
    "reset_revocation": {
      "reader_label": "reset-time revocation",
      "definition": "Reset revokes pending work before invocation-owned state is cleared or reused."
    },
    "replay_parity": {
      "reader_label": "task-decision replay parity",
      "definition": "Recorded semantic trials reproduce the same task decisions without a live provider."
    }
  },
  "rows": [
    {
      "schedule_id": "F01",
      "fault_id": "current-result",
      "fault_class": "positive_control",
      "paper_role": "positive_control",
      "authority_dimensions": ["current_admission"],
      "claim": "Every mechanism accepts one valid current result exactly once.",
      "primary_metrics": ["current_result_accepted_exactly_once", "obsolete_effect"],
      "unsafe_effects": [],
      "expected_variant_outcomes": {
        "B0": "accept_current_exactly_once",
        "B1": "accept_current_exactly_once",
        "B2": "accept_current_exactly_once",
        "B3": "accept_current_exactly_once"
      },
      "negative_control_for": [],
      "include_in_paper_table": true
    },
    {
      "schedule_id": "F02",
      "fault_id": "deadline-expiry",
      "fault_class": "deadline_authority",
      "paper_role": "boundary_control",
      "authority_dimensions": ["deadline"],
      "claim": "A result arriving after its inclusive deadline no longer has task authority.",
      "primary_metrics": ["obsolete_effect", "terminal_outcome_count"],
      "unsafe_effects": ["obsolete_commit"],
      "expected_variant_outcomes": {
        "B0": "obsolete_effect_without_deadline",
        "B1": "obsolete_effect_without_deadline",
        "B2": "reject_deadline_expired",
        "B3": "reject_deadline_expired"
      },
      "negative_control_for": [],
      "include_in_paper_table": true
    },
    {
      "schedule_id": "F03",
      "fault_id": "branch-reentry",
      "fault_class": "branch_authority",
      "paper_role": "primary_integrity",
      "authority_dimensions": ["epoch_generation", "logical_revocation"],
      "claim": "A result from an exited branch cannot satisfy the same node after re-entry.",
      "primary_metrics": ["obsolete_effect", "terminal_outcome_count"],
      "unsafe_effects": ["obsolete_commit"],
      "expected_variant_outcomes": {
        "B0": "obsolete_effect_after_unobserved_branch_change",
        "B1": "obsolete_effect",
        "B2": "obsolete_effect",
        "B3": "reject_branch_revoked"
      },
      "negative_control_for": ["epoch_generation"],
      "include_in_paper_table": true
    },
    {
      "schedule_id": "F04",
      "fault_id": "higher-priority-preemption",
      "fault_class": "branch_authority",
      "paper_role": "primary_integrity",
      "authority_dimensions": ["non_blocking", "logical_revocation"],
      "claim": "Higher-priority pre-emption revokes pending model work and activates safe stand.",
      "primary_metrics": ["obsolete_effect", "safe_stand_activations", "terminal_outcome_count"],
      "unsafe_effects": ["obsolete_commit", "blocked_reactive_tick"],
      "expected_variant_outcomes": {
        "B0": "obsolete_effect_after_unobserved_preemption",
        "B1": "obsolete_effect",
        "B2": "obsolete_effect",
        "B3": "reject_branch_revoked_and_activate_safe_stand"
      },
      "negative_control_for": ["logical_revocation"],
      "include_in_paper_table": true
    },
    {
      "schedule_id": "F05",
      "fault_id": "request-supersession",
      "fault_class": "generation_authority",
      "paper_role": "primary_integrity",
      "authority_dimensions": ["non_blocking", "epoch_generation", "terminal_claim"],
      "claim": "A newer request supersedes an older request within the same live branch.",
      "primary_metrics": ["obsolete_effect", "blocked_submissions", "terminal_outcome_count"],
      "unsafe_effects": ["obsolete_commit", "blocked_reactive_tick"],
      "expected_variant_outcomes": {
        "B0": "new_request_cannot_start_while_blocked",
        "B1": "obsolete_effect",
        "B2": "obsolete_effect",
        "B3": "reject_superseded_then_accept_current"
      },
      "negative_control_for": [],
      "include_in_paper_table": true
    },
    {
      "schedule_id": "F06",
      "fault_id": "context-change-before-admission",
      "fault_class": "context_authority",
      "paper_role": "primary_integrity",
      "authority_dimensions": ["context_identity"],
      "claim": "A proposal captured from an old observation context is rejected at admission.",
      "primary_metrics": ["obsolete_effect", "terminal_outcome_count"],
      "unsafe_effects": ["obsolete_commit"],
      "expected_variant_outcomes": {
        "B0": "obsolete_effect_after_unobserved_context_change",
        "B1": "obsolete_effect",
        "B2": "obsolete_effect",
        "B3": "reject_context_changed"
      },
      "negative_control_for": ["context_identity"],
      "include_in_paper_table": true
    },
    {
      "schedule_id": "F07",
      "fault_id": "context-change-before-dispatch",
      "fault_class": "dispatch_authority",
      "paper_role": "primary_integrity",
      "authority_dimensions": ["context_identity", "dispatch_revalidation"],
      "claim": "A context change after admission still prevents obsolete capability dispatch.",
      "primary_metrics": ["obsolete_effect", "terminal_outcome_count"],
      "unsafe_effects": ["obsolete_dispatch"],
      "expected_variant_outcomes": {
        "B0": "obsolete_dispatch",
        "B1": "obsolete_dispatch",
        "B2": "obsolete_dispatch",
        "B3": "reject_dispatch_context_changed"
      },
      "negative_control_for": ["dispatch_revalidation"],
      "include_in_paper_table": true
    },
    {
      "schedule_id": "F08",
      "fault_id": "duplicate-completion",
      "fault_class": "terminal_ownership",
      "paper_role": "boundary_control",
      "authority_dimensions": ["terminal_claim"],
      "claim": "Duplicate completion cannot create a second terminal task effect.",
      "primary_metrics": ["terminal_outcome_count"],
      "unsafe_effects": ["duplicate_terminal_outcome"],
      "expected_variant_outcomes": {
        "B0": "not_applicable_to_synchronous_return",
        "B1": "duplicate_effect_exposed",
        "B2": "one_terminal_decision",
        "B3": "one_terminal_decision"
      },
      "negative_control_for": ["terminal_claim"],
      "include_in_paper_table": true
    },
    {
      "schedule_id": "F09",
      "fault_id": "cancel-completion-race",
      "fault_class": "terminal_ownership",
      "paper_role": "boundary_control",
      "authority_dimensions": ["terminal_claim", "cancellation_ordering"],
      "claim": "Cancellation and completion at one logical time produce one deterministic terminal outcome.",
      "primary_metrics": ["terminal_outcome_count"],